Genre,Reports,Age,GPA,Year,Count,Gender,Nationality,Resolution
International student experiences,"4. I appreciate the efforts the university has made to create a diverse and inclusive environment, but as an international student, I still feel like an outsider. It's hard to find common ground with people who have such different experiences and perspectives.",24,0.47,5,1,F,France,Create a feedback system for international students to share their experiences and suggest improvements to campus services.
International student experiences,"5. I've been trying to improve my language skills and learn more about the culture of the country I'm studying in, but it's a slow process. Sometimes it feels like there's a language barrier that's impossible to overcome.",26,3.16,1,1,M,France,Provide access to online language courses and resources to help international students improve their language skills at their own pace.
International student experiences,"6. I think it would be helpful if the university organized more events and activities that are specifically designed to bring international and domestic students together. That way, we could learn from each other and build stronger relationships.",23,2.94,4,1,M,France,Organize study groups for international students to help them collaborate and succeed academically.
International student experiences,"7. I appreciate the efforts of my fellow students to include me in their social circles, but sometimes I feel like they're just being polite and don't really want to get to know me. It's hard to know how to approach these situations.",20,0.69,5,1,M,France,"Develop a mobile app with resources for international students, including language tools, event calendars, and support services."
International student experiences,8. I wish the university offered more language classes and tutoring services for international students. It can be difficult to keep up with coursework when you're struggling to understand the language.,27,0.46,2,1,M,France,Offer workshops on public speaking and presentation skills to help international students build confidence in academic and professional settings.
International student experiences,9. I think it's important for the university to recognize the challenges that international students face and provide more support and resources to help us succeed academically and socially.,26,2.06,4,1,M,France,Provide scholarships or financial aid specifically for international students to reduce financial stress.
International student experiences,10. Sometimes I feel like my cultural background is a barrier to making friends and fitting in with the rest of the student body. It's hard to know how to bridge that gap and find common ground with people who have such different experiences than me.,20,1.95,3,1,M,France,Create a cultural exchange program for sharing traditions and customs.
International student experiences,"11. I appreciate the efforts of my professors and classmates to help me feel included and supported, but there are still times when I feel like I'm on the outside looking in. It's a tough position to be in.",20,0.36,2,1,F,France,Provide training for faculty on how to support international students in the classroom and beyond.
International student experiences,"12. I think it would be helpful if the university provided more opportunities for international students to get involved in campus organizations and clubs. That way, we could meet more people and feel more connected to the campus community.",27,2.58,3,1,M,France,Organize networking events tailored to international students to help them build professional connections.
International student experiences,13. I sometimes feel like I'm not taken seriously or my ideas aren't valued because of my accent or the way I express myself. It's discouraging and makes me feel like I don't belong.,18,1.49,4,1,F,France,Offer workshops on overcoming language barriers and building confidence in academic and social settings.
International student experiences,"14. I appreciate the efforts of the university to create a welcoming environment for international students, but sometimes it feels like a lot of the burden is placed on us to adapt and assimilate. It would be nice to have more support and understanding from the rest of the campus community.",18,2.37,2,1,F,France,Create a cultural awareness campaign to educate the campus community about the challenges faced by international students.
International student experiences,"15. I've been trying to connect with other international students who speak the same language as me, but it's been difficult to find people who share my interests and hobbies. It can be isolating.",25,3.63,3,1,F,France,Host regular social events specifically for international students to help them build friendships and feel less isolated.
International student experiences,"16. I think it's important for the university to provide more cultural competency training for all students and faculty. That way, we can all learn how to better communicate and interact with people from different backgrounds.",25,0.09,3,1,F,France,Provide training for faculty on how to support international students in the classroom and beyond.
International student experiences,"17. Sometimes I feel like my language and cultural differences are all people see when they look at me. I want to be recognized for my talents and abilities, not just my background.",27,0.95,4,1,F,France,"Create a career support program for international students, including resume building and interview preparation in multiple languages."
International student experiences,18. I think it's important for the university to create more opportunities for international students,17,0.11,2,1,M,France,"Develop a mobile app with resources for international students, including language tools, event calendars, and support services."
International student experiences,1. I feel isolated and lonely sometimes because I can't connect with other students due to the language barrier. It's hard to join conversations and make friends when you don't speak the same language.,24,3.24,1,1,F,France,Launch a language exchange program to help international students improve their communication skills and connect with peers.
International student experiences,"2. I love the diversity on campus, but sometimes it's hard to communicate with international students because of the cultural differences. It can be frustrating trying to understand their perspectives and vice versa.",25,3.46,4,1,F,France,Organize cultural competency training for domestic students to foster understanding and inclusivity for international students.
International student experiences,3. I think it would be helpful if the university provided more opportunities for international and domestic students to interact and learn from each other. Maybe language classes or cultural events.,17,2.68,3,1,F,France,Host regular cultural events to celebrate diversity and encourage interaction between international and domestic students.
International student experiences,4. I feel like I'm missing out on a lot because I can't fully participate in class discussions and group projects. It's hard to contribute when you don't have a full understanding of the language.,16,1.8,3,1,M,France,Offer workshops on overcoming language barriers and building confidence in academic and social settings.
International student experiences,"5. I appreciate the efforts that some professors make to accommodate international students, but I think there could be more support and resources available. Maybe a tutoring program or language exchange program.",24,2.48,3,1,M,France,"Expand language support services, including tutoring and conversation practice, to help international students improve fluency."
International student experiences,6. It's frustrating when professors and classmates assume that all students are familiar with certain cultural references or idioms. It would be nice if there was more education and awareness around cultural differences.,23,1.02,4,1,F,France,Provide training for professors on the challenges faced by international students to ensure inclusive teaching practices.
International student experiences,7. I've noticed that some international students are hesitant to speak up in class or ask questions because they're afraid of being misunderstood or judged. It would be great if the university provided more opportunities for them to practice their language skills in a safe and supportive environment.,22,1.3,2,1,F,France,Create a peer-led language practice program to help international students improve their speaking and listening skills.
International student experiences,8. I think it would be helpful if the university provided more resources for international students who are struggling with language or cultural barriers. Maybe a mentorship program or support group.,17,0.3,3,1,M,France,Establish a mentorship program pairing international students with domestic students for academic and social support.
International student experiences,"9. As a domestic student, I sometimes feel guilty that I don't know more about other cultures and languages. I wish there were more opportunities for me to learn and engage with international students.",25,3.94,5,1,M,France,Organize cultural exchange programs where domestic and international students can learn from each other's cultures and experiences.
