Genre,Reports,Age,GPA,Year,Count,Gender,Nationality,Resolution
Online learning,Online classes require a lot of self-discipline and time management skills that not all students have developed yet.,26,2.98,1,1,F,Mexico,Offer workshops on time management and self-discipline to help students succeed in online classes.
Online learning,It is difficult to build relationships with classmates and professors in an online setting.,16,3.95,2,1,M,Mexico,Create virtual networking events and discussion forums to help students build relationships with classmates and professors.
Online learning,"The quality of education in online classes is not the same as in-person classes, and it can be frustrating to pay full tuition for a lesser experience.",20,3.5,5,1,F,Mexico,Improve the quality of online classes by incorporating interactive and engaging teaching methods.
Online learning,The lack of access to campus resources and facilities is a major downside to online classes.,23,2.72,3,1,M,Mexico,Provide online students with access to digital library resources and virtual student support services.
Online learning,The time difference for international students can make it difficult to attend online classes and participate in group projects.,22,3.85,1,1,F,Mexico,Offer flexible class schedules and recorded lectures to accommodate students in different time zones.
Online learning,The lack of face-to-face interaction in online classes makes it hard to ask questions and receive feedback.,19,3.11,3,1,M,Mexico,Increase professor availability during online classes and provide additional support through teaching assistants.
Online learning,"The online format can be especially challenging for hands-on courses like art, music, and lab-based sciences.",23,2.87,5,1,F,Mexico,Develop virtual simulations and interactive tools to help students in hands-on courses succeed in an online format.
Online learning,Limited access to technical resources and software can hinder the learning experience in online classes.,22,1.68,3,1,F,Mexico,Provide online students with access to necessary technical resources and software.
Online learning,"It is challenging to maintain focus and avoid distractions during online classes, especially for students living in crowded or noisy environments.",23,2.5,5,1,M,Mexico,Offer workshops on focus and productivity to help students succeed in online classes.
Online learning,The increased screen time from online classes can cause eye strain and fatigue.,17,1.48,1,1,M,Mexico,Provide resources and tips on managing screen time and reducing eye strain for online students.
Online learning,Online exams and assessments can be more challenging and stressful than in-person tests.,18,2.9,1,1,F,Mexico,Offer practice exams and stress management workshops to help students prepare for online assessments.
Online learning,It is difficult to stay motivated and accountable for completing online coursework without the structure of in-person classes.,16,0.12,3,1,F,Mexico,Introduce virtual study groups and peer support networks to help students stay motivated and accountable.
Online learning,Online classes can exacerbate feelings of isolation and loneliness for students who struggle to make connections with peers.,19,3.73,1,1,F,Mexico,Create virtual social events and online communities to help students feel more connected to their peers.
Online learning,Technical difficulties with online exams and quizzes can lead to anxiety and frustration.,20,3.05,4,1,M,Mexico,Provide technical support and resources to help students overcome technical difficulties during online exams.
Online learning,The lack of access to professors during online classes can make it difficult to receive help and feedback on coursework.,25,1.02,4,1,F,Mexico,Increase professor availability during online classes and provide additional support through teaching assistants.
Online learning,Online classes can make it harder to balance academic responsibilities with work or family obligations.,22,0.36,2,1,M,Mexico,Offer flexible class schedules and recorded lectures to help students balance academic responsibilities with other commitments.
Online learning,Limited access to internships and job opportunities for online students can hinder their career prospects.,22,3.0,5,1,F,Mexico,Expand virtual internship and job opportunities for online students to ensure they have equal access to career development resources.
Online learning,The lack of networking opportunities and professional development events for online students can be a major drawback.,25,3.78,3,1,F,Mexico,Organize virtual networking events and professional development workshops for online students.
Online learning,The online format can make it challenging to participate in extracurricular activities and clubs.,27,0.46,5,1,M,Mexico,Create virtual extracurricular activities and clubs to help online students stay engaged and connected.
Online learning,Online classes can create a sense of disconnection from the campus community and culture.,23,1.75,2,1,F,Mexico,Create virtual campus tours and online events to help online students feel more connected to the campus community.
Online learning,It is harder to form study groups and collaborate with classmates in an online setting.,24,2.0,5,1,F,Mexico,Introduce virtual study groups and collaboration tools to help students work together effectively.
Online learning,Technical difficulties with online class recordings can lead to missed lectures and important information.,19,4.0,4,1,M,Mexico,Provide technical support and resources to help students access online class recordings and stay on track with coursework.
Online learning,The lack of access to campus facilities like libraries and study spaces can make it harder to study and complete coursework.,20,0.06,3,1,M,Mexico,Provide online students with access to digital library resources and virtual study spaces.
Online learning,Online classes can be particularly challenging for students who need hands-on assistance from professors or peers.,22,3.49,2,1,F,Mexico,Increase professor availability during online classes and provide additional support through teaching assistants.
Online learning,The lack of in-person support and resources for mental health and wellness can make online classes particularly difficult for some students.,23,0.12,5,1,F,Mexico,"Expand virtual mental health and wellness resources for online students, including counseling and support groups."
Online learning,The lack of access to campus events and activities can make the college experience feel incomplete for online students.,27,1.54,1,1,F,Mexico,Create virtual campus events and activities to help online students feel more connected to the college experience.
Online learning,The limited availability of online courses and programs can make it difficult for students to meet graduation requirements or pursue specific fields of study.,20,1.35,2,1,F,Mexico,Expand the availability of online courses and programs to ensure students can meet graduation requirements and pursue their desired fields of study.
